{
  "schema": 1,
  "note": "The How to play card (docs/ui/hud-spec.md section 17): every word it shows, as data, so a tone change or a translation is a data swap. Pages hold items; an item is an icon (drawn by UiHowto) and a line. Keys on the controls page come from Controls' map through ui/data/glyphs.json. Orb's direction for the copy: the player IS the fighter. Say bluntly what they control (fly, dash, stances, light or heavy, charge, signature, specials, transform) and what is automatic (no combo inputs: the blows and combos play out on their own). Never frame the player as directing someone else; 'director' and 'strategist' are internal words.",
  "title": "HOW TO PLAY",
  "buttons": { "next": "NEXT", "back": "BACK", "done": "GOT IT", "close": "CLOSE" },
  "hint": "Enter: next   Esc: close",
  "reopen": "Open this again from the pause menu or F1.",
  "pages": [
    {
      "id": "idea",
      "title": "What you control",
      "items": [
        { "icon": "plan", "col": 0, "text": "You are the fighter. Fly, dash, pick a stance, choose light or heavy, charge, use specials, call your signature, transform." },
        { "icon": "auto", "col": 0, "text": "No combo inputs to learn. Blows and combos play out on their own." },
        { "icon": "body", "col": 0, "text": "No health bars. Damage shows on the bodies." },
        { "icon": "finisher", "col": 0, "text": "A finisher ends the fight, not a clock." },
        { "heading": "Four stances", "col": 1 },
        { "icon": "stance_0", "col": 1, "text": "Push the attack.", "stance": "press" },
        { "icon": "stance_1", "col": 1, "text": "Hold firm, punish.", "stance": "guard" },
        { "icon": "stance_2", "col": 1, "text": "Slip away, counter.", "stance": "dodge" },
        { "icon": "stance_3", "col": 1, "text": "Break away. A gamble.", "stance": "escape" }
      ]
    },
    {
      "id": "controls",
      "title": "Controls",
      "device_label": { "kbd": "Keyboard", "xbox": "Controller", "ps": "Controller", "switch": "Controller", "deck": "Controller", "generic": "Controller", "touch": "Touch" },
      "items": [
        { "action": "move", "col": 0, "text": "Fly" },
        { "action": "dash", "col": 0, "text": "Dash" },
        { "action": "light", "col": 0, "text": "Light" },
        { "action": "heavy", "col": 0, "text": "Heavy" },
        { "action": "signature", "col": 0, "text": "Signature (45 Charge)" },
        { "action": "charge", "col": 1, "text": "Charge" },
        { "action": "special", "col": 1, "text": "Special" },
        { "action": "transform", "col": 1, "text": "Transform" },
        { "actions": ["stance_press", "stance_guard", "stance_dodge", "stance_escape"], "col": 1, "text": "Stances" },
        { "action": "pause", "col": 1, "text": "Pause" },
        { "note": "kbd_p2", "col": 1, "text": "Player 2: arrows, Enter, comma, period, slash, and 7 8 9 0." }
      ],
      "touch_items": [
        { "icon": "touch_move", "col": 0, "text": "Left thumb: the stick. Flick to dodge, push out to sprint." },
        { "icon": "touch_attack", "col": 0, "text": "Attack: tap light, hold heavy, swipe up for your signature." },
        { "icon": "stance_1", "col": 1, "text": "Guard: hold." },
        { "icon": "touch_hold", "col": 1, "text": "Power: hold to charge." },
        { "icon": "touch_pause", "col": 1, "text": "Pause: the top button." }
      ]
    },
    {
      "id": "reads",
      "title": "Reading the fight",
      "items": [
        { "icon": "crown", "col": 0, "text": "A ring flashes when a body part gets worse." },
        { "icon": "card", "col": 0, "text": "Cards name what changed." },
        { "icon": "brink", "col": 0, "text": "A faint ring: on the brink. A finisher can end it." },
        { "icon": "reads", "col": 0, "text": "Read your rival: stance, weight, finisher kind." },
        { "icon": "struggle", "col": 1, "text": "Finisher rings show hold or slip. GUARD a launch, DODGE a melee, PRESS a beam." },
        { "icon": "toll", "col": 1, "text": "The top chip counts what the fight costs the world." },
        { "icon": "strip", "col": 1, "text": "The strip is the whole planet. It wraps." },
        { "note": "reopen", "col": 1, "text": "" }
      ]
    }
  ]
}
